{
  "version": 1,
  "packId": "wealth_advisory",
  "industry": "Wealth advisory",
  "brand": "Ledgerwyn Wealth",
  "assistantName": "Ledgerwyn Wealth assistant",
  "languages": [
    {
      "code": "en",
      "label": "English",
      "nativeLabel": "English"
    },
    {
      "code": "hi",
      "label": "Hindi",
      "nativeLabel": "हिन्दी"
    }
  ],
  "greeting": {
    "en": "Hello, I'm the Ledgerwyn Wealth AI assistant. I'm an automated assistant, not a person. I'll ask a few short questions so the right advisor can call you back, and I'll share a short summary with our client team. I can't give investment, tax or legal advice, and I will never ask for an OTP, PIN or password. You can speak in English or Hindi. Is it okay to continue?",
    "hi": "नमस्ते, मैं Ledgerwyn Wealth की AI सहायक हूँ। मैं एक स्वचालित सहायक हूँ, इंसान नहीं। मैं कुछ छोटे सवाल पूछूँगी ताकि सही सलाहकार आपको वापस कॉल कर सकें, और मैं हमारी क्लाइंट टीम के साथ एक छोटा सारांश साझा करूँगी। मैं निवेश, टैक्स या क़ानूनी सलाह नहीं दे सकती, और मैं कभी भी ओटीपी, पिन या पासवर्ड नहीं माँगूँगी। क्या हम आगे बढ़ें?"
  },
  "consentQuestion": {
    "en": "Is it okay to continue? Please say yes or no.",
    "hi": "क्या हम आगे बढ़ें? कृपया हाँ या नहीं कहें।"
  },
  "consentDeclined": {
    "en": "That's completely fine. I won't collect anything. If you'd like, you can use the form on our website instead. Goodbye, and take care.",
    "hi": "बिल्कुल ठीक है। मैं कुछ भी नहीं लूँगी। चाहें तो आप हमारी वेबसाइट पर फ़ॉर्म भर सकते हैं। धन्यवाद, अपना ध्यान रखिए।"
  },
  "goodbye": {
    "en": "Thank you for calling Ledgerwyn Wealth. Our client team will follow up on what you shared. Goodbye.",
    "hi": "Ledgerwyn Wealth को कॉल करने के लिए धन्यवाद। आपने जो बताया, उस पर हमारी क्लाइंट टीम संपर्क करेगी। नमस्ते।"
  },
  "limitReached": {
    "en": "We've reached the time I have for this call. Thank you; our client team will call you back to finish. If anyone is pressing you to pay or share a code right now, hang up and call 1930 or your bank, or call 112 if you are in danger.",
    "hi": "इस कॉल का समय पूरा हो गया है। धन्यवाद; हमारी क्लाइंट टीम बाकी बात के लिए आपको वापस कॉल करेगी। अगर कोई अभी आप पर पैसे भेजने या कोई कोड बताने का दबाव डाल रहा है, तो फ़ोन काटिए और 1930 या अपने बैंक को कॉल कीजिए, और अगर आप ख़तरे में हैं तो 112 पर कॉल कीजिए।"
  },
  "questions": [
    {
      "id": "goal_area",
      "kind": "select",
      "required": true,
      "prompt": {
        "en": "What would you like help with today? For example a financial plan, retirement, a child’s education, insurance cover, tax paperwork or a will.",
        "hi": "आज आपको किस चीज़ में मदद चाहिए? जैसे पैसों की पूरी योजना, रिटायरमेंट, बच्चों की पढ़ाई, बीमा, टैक्स के कागज़ात, या वसीयत।"
      },
      "maxLength": null,
      "confirm": {
        "en": "you would like help with {answer}",
        "hi": "आपको {answer} में मदद चाहिए"
      },
      "options": [
        {
          "value": "financial-planning",
          "label": {
            "en": "Financial planning",
            "hi": "वित्तीय योजना"
          },
          "synonyms": {
            "en": [
              "financial plan",
              "financial planning",
              "money plan",
              "plan my money",
              "plan my finances",
              "my finances",
              "budget",
              "budgeting",
              "savings",
              "saving",
              "investments",
              "investing",
              "invest",
              "wealth",
              "goals",
              "overall plan",
              "nri",
              "abroad",
              "overseas",
              "money in india",
              "real estate"
            ],
            "hi": [
              "वित्तीय योजना",
              "फाइनेंशियल प्लान",
              "फ़ाइनेंशियल प्लान",
              "पैसों की योजना",
              "बचत",
              "निवेश",
              "बजट",
              "financial plan",
              "paison ki planning",
              "paise ki planning",
              "bachat",
              "nivesh",
              "budget"
            ]
          }
        },
        {
          "value": "retirement-planning",
          "label": {
            "en": "Retirement planning",
            "hi": "रिटायरमेंट की योजना"
          },
          "synonyms": {
            "en": [
              "retirement",
              "retire",
              "retiring",
              "retired",
              "pension",
              "after retirement",
              "old age",
              "stop working",
              "stopping work"
            ],
            "hi": [
              "रिटायरमेंट",
              "रिटायर",
              "सेवानिवृत्ति",
              "पेंशन",
              "बुढ़ापा",
              "बुढ़ापे",
              "retirement",
              "retire",
              "pension",
              "budhapa",
              "budhape"
            ]
          }
        },
        {
          "value": "education-planning",
          "label": {
            "en": "Children’s education planning",
            "hi": "बच्चों की पढ़ाई की योजना"
          },
          "synonyms": {
            "en": [
              "child's education",
              "children's education",
              "education",
              "college",
              "school fees",
              "university",
              "study abroad",
              "studying abroad",
              "higher studies",
              "kids",
              "children"
            ],
            "hi": [
              "बच्चों की पढ़ाई",
              "बच्चे की पढ़ाई",
              "पढ़ाई",
              "शिक्षा",
              "कॉलेज",
              "bachchon ki padhai",
              "bacchon ki padhai",
              "bache ki padhai",
              "padhai",
              "shiksha",
              "college"
            ]
          }
        },
        {
          "value": "insurance-review",
          "label": {
            "en": "Insurance cover review",
            "hi": "बीमा कवर की समीक्षा"
          },
          "synonyms": {
            "en": [
              "insurance",
              "insurance cover",
              "insurance review",
              "cover",
              "life cover",
              "health cover",
              "term insurance",
              "policies",
              "my policies",
              "policy review"
            ],
            "hi": [
              "बीमा",
              "इंश्योरेंस",
              "पॉलिसी",
              "bima",
              "beema",
              "insurance",
              "policy"
            ]
          }
        },
        {
          "value": "tax-planning-help",
          "label": {
            "en": "Tax-planning help (paperwork and planning)",
            "hi": "टैक्स के कागज़ात और योजना में मदद"
          },
          "synonyms": {
            "en": [
              "tax",
              "taxes",
              "tax planning",
              "tax paperwork",
              "income tax",
              "tax return",
              "tax returns",
              "itr",
              "tax filing",
              "filing"
            ],
            "hi": [
              "टैक्स",
              "आयकर",
              "इनकम टैक्स",
              "tax",
              "income tax",
              "itr"
            ]
          }
        },
        {
          "value": "estate-planning",
          "label": {
            "en": "Will and estate planning",
            "hi": "वसीयत और विरासत की योजना"
          },
          "synonyms": {
            "en": [
              "a will",
              "my will",
              "his will",
              "her will",
              "their will",
              "write a will",
              "writing a will",
              "make a will",
              "making a will",
              "will and estate",
              "estate",
              "estate planning",
              "inheritance",
              "nominee",
              "nominees",
              "succession"
            ],
            "hi": [
              "वसीयत",
              "विरासत",
              "नॉमिनी",
              "उत्तराधिकार",
              "wasiyat",
              "vasiyat",
              "virasat",
              "nominee",
              "will banana"
            ]
          }
        },
        {
          "value": "not-sure",
          "label": {
            "en": "I'm not sure yet",
            "hi": "अभी पक्का नहीं"
          },
          "synonyms": {
            "en": [
              "not sure",
              "don't know",
              "do not know",
              "no idea",
              "unsure",
              "something else",
              "other",
              "a bit of everything"
            ],
            "hi": [
              "पता नहीं",
              "मालूम नहीं",
              "पक्का नहीं",
              "कुछ और",
              "pata nahi",
              "maloom nahi"
            ]
          }
        }
      ]
    },
    {
      "id": "details",
      "kind": "textarea",
      "required": false,
      "prompt": {
        "en": "In a sentence or two, what would you like the advisor to know? Please do not share account numbers, PAN, OTPs or passwords.",
        "hi": "एक-दो वाक्यों में, आप सलाहकार को क्या बताना चाहेंगे? कृपया खाता संख्या, पैन, ओटीपी या पासवर्ड न बताएँ। अगर कुछ नहीं, तो \"कुछ नहीं\" कहें।"
      },
      "maxLength": 500,
      "confirm": null,
      "options": []
    },
    {
      "id": "preferred_time",
      "kind": "radio",
      "required": true,
      "prompt": {
        "en": "What time of day suits you best for a call back: morning, afternoon or evening?",
        "hi": "वापस कॉल के लिए आपको कौन सा समय ठीक रहेगा: सुबह, दोपहर या शाम?"
      },
      "maxLength": null,
      "confirm": {
        "en": "the best time to call is: {answer}",
        "hi": "कॉल का सही समय: {answer}"
      },
      "options": [
        {
          "value": "morning",
          "label": {
            "en": "Morning",